Morphological change in machines accelerates the evolution of robust behavior:::Most animals exhibit significant neurological and morphological change throughout their lifetime. No robots to date, however, grow new morphological structure while behaving. This is due to technological limitations but also because it is unclear that morphological change provides a benefit to the acquisition of robust behavior in machines. Here I show that in evolving populations of simulated robots, if robots grow from anguilliform into legged robots during their lifetime in the early stages of evolution, and the anguilliform body plan is gradually lost during later stages of evolution, gaits are evolved for the final, legged form of the robot more rapidly—and the evolved gaits are more robust—compared to evolving populations of legged robots that do not transition through the anguilliform body plan. This suggests that morphological change, as well as the evolution of development, are two important processes that improve the automatic generation of robust behaviors for machines. It also provides an experimental platform for investigating the relationship between the evolution of development and robust behavior in biological organisms.::::::Published::::::http://www.pnas.org/content/108/4/1234.abstract
Innocent Until Proven Guilty: Reducing Robot Shaping From Polynomial to Linear Time:::In evolutionary algorithms, much time is spent evaluating inferior phenotypes that produce no offspring. A common heuristic to address this inefficiency is to stop evaluations early if they hold little promise of attaining high fitness. However, the form of this heuristic is typically dependent on the fitness function used, and there is a danger of prematurely stopping evaluation of a phenotype that may have recovered in the remainder of the evaluation period. Here a stopping method is introduced that gradually reduces fitness over the phenotype's evaluation, rather than accumulating fitness. This method is independent of the fitness function used, only stops those phenotypes that are guaranteed to become inferior to the current offspring-producing phenotypes, and realizes significant time savings across several evolutionary robotics tasks. It was found that for many tasks, time complexity was reduced from polynomial to sublinear time, and time savings increased with the number of training instances used to evaluate a phenotype as well as with task difficulty.::::::Published::::::http://ieeexplore.ieee.org/xpls/abs_all.jsp?arnumber=5703121
Self discovery enables robot social cognition: Are you my teacher?:::Infants exploit the perception that others are ‘like me’ to bootstrap social cognition (Meltzoff, 2007a). This paper demonstrates how the above theory can be instantiated in a social robot that uses itself as a model to recognize structural similarities with other robots; this thereby enables the student to distinguish between appropriate and inappropriate teachers. This is accomplished by the student robot first performing self-discovery, a phase in which it uses actuation–perception relationships to infer its own structure. Second, the student models a candidate teacher using a vision-based active learning approach to create an approximate physical simulation of the teacher. Third, the student determines that the teacher is structurally similar (but not necessarily visually similar) to itself if it can find a neural controller that allows its self model (created in the first phase) to reproduce the perceived motion of the teacher model (created in the second phase). Fourth, the student uses the neural controller (created in the third phase) to move, resulting in imitation of the teacher. Results with a physical student robot and two physical robot teachers demonstrate the effectiveness of this approach. The generalizability of the proposed model allows it to be used over variations in the demonstrator: The student robot would still be able to imitate teachers of different sizes and at different distances from itself, as well as different positions in its field of view, because change in the interrelations of the teacher’s body parts are used for imitation, rather than absolute geometric properties.:::http://ars.els-cdn.com/content/image/1-s2.0-S0893608010001486-gr6.jpg:::Published::::::http://www.sciencedirect.com/science/article/pii/S0893608010001486
The Utility of Evolving Simulated Robot Morphology Increases with Task Complexity for Object Manipulation:::Embodied artificial intelligence argues that the body and brain play equally important roles in the generation of adaptive behavior. An increasingly common approach therefore is to evolve an agent's morphology along with its control in the hope that evolution will find a good coupled system. In order for embodied artificial intelligence to gain credibility within the robotics and cognitive science communities, however, it is necessary to amass evidence not only for how to co-optimize morphology and control of adaptive machines, but why. This work provides two new lines of evidence for why this co-optimization is useful: Here we show that for an object manipulation task in which a simulated robot must accomplish one, two, or three objectives simultaneously, subjugating more aspects of the robot's morphology to selective pressure allows for the evolution of better robots as the number of objectives increases. In addition, for robots that successfully evolved to accomplish all of their objectives, those composed of evolved rather than fixed morphologies generalized better to previously unseen environmental conditions.::::::Published::::::http://www.mitpressjournals.org/doi/abs/10.1162/artl.2010.Bongard.024
Use of an artificial neural network to predict head injury outcome:::The authors describe the artificial neural network (ANN) as an innovative and powerful modeling tool that can be increasingly applied to develop predictive models in neurosurgery. They aimed to demonstrate the utility of an ANN in predicting survival following traumatic brain injury and compare its predictive ability with that of regression models and clinicians.:::http://thejns.org/na101/home/literatum/publisher/jns/journals/content/jns/2010/jns.2010.113.issue-3/2009.11.jns09857/production/images/medium/jns09857f1.jpg:::Published::::::http://thejns.org/doi/full/10.3171/2009.11.JNS09857
Accelerating Self-Modeling in Cooperative Robot Teams:::One of the major obstacles to achieving robots capable of operating in real-world environments is enabling them to cope with a continuous stream of unanticipated situations. In previous work, it was demonstrated that a robot can autonomously generate self-models, and use those self-models to diagnose unanticipated morphological change such as damage. In this paper, it is shown that multiple physical quadrupedal robots with similar morphologies can share self-models in order to accelerate modeling. Further, it is demonstrated that quadrupedal robots which maintain separate self-modeling algorithms but swap self-models perform better than quadrupedal robots that rely on a shared self-modeling algorithm. This finding points the way toward more robust robot teams: a robot can diagnose and recover from unanticipated situations faster by drawing on the previous experiences of the other robots.::::::Published::::::http://ieeexplore.ieee.org/xpl/articleDetails.jsp?tp=
Automated reverse engineering of nonlinear dynamical systems:::Complex nonlinear dynamics arise in many fields of science and engineering, but uncovering the underlying differential equations directly from observations poses a challenging task. The ability to symbolically model complex networked systems is key to understanding them, an open problem in many disciplines. Here we introduce for the first time a method that can automatically generate symbolic equations for a nonlinear coupled dynamical system directly from time series data. This method is applicable to any system that can be described using sets of ordinary nonlinear differential equations, and assumes that the (possibly noisy) time series of all variables are observable. Previous automated symbolic modeling approaches of coupled physical systems produced linear models or required a nonlinear model to be provided manually. The advance presented here is made possible by allowing the method to model each (possibly coupled) variable separately, intelligently perturbing and destabilizing the system to extract its less observable characteristics, and automatically simplifying the equations during modeling. We demonstrate this method on four simulated and two real systems spanning mechanics, ecology, and systems biology. Unlike numerical models, symbolic models have explanatory value, suggesting that automated “reverse engineering” approaches for model-free symbolic nonlinear system identification may play an increasing role in our ability to understand progressively more complex systems in the future.:::http://www.pnas.org/content/104/24/9943/F1.small.gif:::Published::::::http://www.pnas.org/content/104/24/9943.abstract
Resilient Machines Through Continuous Self-Modeling:::Animals sustain the ability to operate after injury by creating qualitatively different compensatory behaviors. Although such robustness would be desirable in engineered systems, most machines fail in the face of unexpected damage. We describe a robot that can recover from such change autonomously, through continuous self-modeling. A four-legged machine uses actuation-sensation relationships to indirectly infer its own structure, and it then uses this self-model to generate forward locomotion. When a leg part is removed, it adapts the self-models, leading to the generation of alternative gaits. This concept may help develop more robust machines and shed light on self-modeling in animals.:::http://www.sciencemag.org/content/314/5802/1118/F1.small.gif:::Published::::::http://www.sciencemag.org/content/314/5802/1118.abstract
Co-evolutionary algorithm for structural damage identification using minimal physical testing:::The problem of damage identification using minimum test data is studied in this work. Data sparsity in damage identification applications commonly results in inverse problems that are mathematically ill-posed (e.g. non-unique solutions). Although solution non-uniqueness may be addressed by performing multiple tests on a structure, it is not trivial to decide which tests to carry out given that actual physical testing is costly. This problem is addressed in this work through a new co-evolutionary algorithm that interactively searches for damage scenarios and optimum physical tests. The algorithm is composed of two stages: the estimation phase, which searches for damage scenarios that can predict current physical tests, and the exploration phase, which searches for tests that increase the level of information about the damaged system. The feasibility of the methodology is demonstrated using numerical examples.::::::Published::::::http://onlinelibrary.wiley.com/doi/10.1002/nme.1803/abstract
Active Coevolutionary Learning of Deterministic Finite Automata:::This paper describes an active learning approach to the problem of grammatical inference, specifically the inference of deterministic finite automata (DFAs). We refer to the algorithm as the estimation-exploration algorithm (EEA). This approach differs from previous passive and active learning approaches to grammatical inference in that training data is actively proposed by the algorithm, rather than passively receiving training data from some external teacher. Here we show that this algorithm outperforms one version of the most powerful set of algorithms for grammatical inference, evidence driven state merging (EDSM), on randomly-generated DFAs. The performance increase is due to the fact that the EDSM algorithm only works well for DFAs with specific balances (percentage of positive labelings), while the EEA is more consistent over a wider range of balances. Based on this finding we propose a more general method for generating DFAs to be used in the development of future grammatical inference algorithms.::::::Published::::::http://jmlr.org/papers/v6/bongard05a.html
Nonlinear System Identification Using Coevolution of Models and Tests:::We present a coevolutionary algorithm for inferring the topology and parameters of a wide range of hidden nonlinear systems with a minimum of experimentation on the target system. The algorithm synthesizes an explicit model directly from the observed data produced by intelligently generated tests. The algorithm is composed of two coevolving populations. One population evolves candidate models that estimate the structure of the hidden system. The second population evolves informative tests that either extract new information from the hidden system or elicit desirable behavior from it. The fitness of candidate models is their ability to explain behavior of the target system observed in response to all tests carried out so far; the fitness of candidate tests is their ability to make the models disagree in their predictions. We demonstrate the generality of this estimation-exploration algorithm by applying it to four different problems—grammar induction, gene network inference, evolutionary robotics, and robot damage recovery—and discuss how it overcomes several of the pathologies commonly found in other coevolutionary algorithms. We show that the algorithm is able to successfully infer and/or manipulate highly nonlinear hidden systems using very few tests, and that the benefit of this approach increases as the hidden systems possess more degrees of freedom, or become more biased or unobservable. The algorithm provides a systematic method for posing synthesis or analysis tasks to a coevolutionary system.::::::Published::::::http://ieeexplore.ieee.org/xpl/articleDetails.jsp?arnumber=1492385
New Robotics: Design Principles for Intelligent Systems:::New Robotics designates an approach to robotics that, in contrast to traditional robotics, employs ideas and principles from biology. While in the traditional approach there are generally accepted methods (e.g. from control theory), designing agents in the New Robotics approach is still largely considered an art. In recent years, we have been developing a set of heuristics or design principles, that on the one hand capture theoretical insights about intelligent – adaptive – behavior, and on the other provide guidance in actually designing and building systems. In this paper we provide an overview of all the principles but focus on the principles of 'ecological balance' which concerns the relation between environment, morphology, materials, and control, and 'sensory-motor coordination' which concerns self-generated sensory stimulation as the agent interacts with the environment and which is a key to the development of high-level intelligence. As we will argue, artificial evolution together with morphogenesis is not only 'nice to have' but is in fact a necessary tool for designing embodied agents.::::::Published::::::http://www.cs.uvm.edu/~jbongard/papers/2004_ALife_Pfeifer.pdf
Improving Genetic Programming Based Symbolic Regression Using Deterministic Machine Learning:::Symbolic regression (SR) is a well studied method in genetic programming (GP) for discovering free-form mathematical models from observed data. However, it has not been widely accepted as a standard data science tool. The reluctance is in part due to the hard to analyze random nature of GP and scalability issues. On the other hand, most popular deterministic regression algorithms were designed to generate linear models and therefore lack the flexibility of GP based SR (GP-SR). Our hypothesis is that hybridizing these two techniques will create a synergy between the GP-SR and deterministic approaches to machine learning, which might help bring the GP based techniques closer to the realm of big learning. In this paper, we show that a hybrid deterministic/GP-SR algorithm outperforms GP-SR alone and the state-of-the-art deterministic regression technique alone on a set of multivariate polynomial symbolic regression tasks as the system to be modeled becomes more multivariate.::::::Published::::::http://www.cs.uvm.edu/~jbongard/papers/2013_CEC_Icke_1.pdf
Modeling Hierarchy using Symbolic Regression:::Symbolic Regression is an attractive modeling approach because it can capture and present, mathematically, relationships between variables of interest. However, given n variables to model, symbolic regression returns a flat list of n equations. As the number of state variables to be modeled scales, interpretation of such a list becomes difficult. Here we present a symbolic regression method that detects and captures hidden hierarchy in a given system. The method returns the equations in a hierarchical dependency graph, which increases the interpretability of the results. We demonstrate that two variations of this hierarchical modeling approach outperform non-hierarchical symbolic regression on a synthetic data suite.::::::Published::::::http://www.cs.uvm.edu/~jbongard/papers/2013_CEC_Icke_2.pdf
Avoiding Local Optima with User Demonstrations and Low-level Control:::Interactive Evolutionary Algorithms (IEAs) use human input to help drive a search process. Traditionally, IEAs allow the user to exhibit preferences among some set of individuals. Here we present a system in which the user directly demonstrates what he or she prefers. Demonstration has an advantage over preferences because the user can provide the system with a solution that would never have been presented to a user who can only provide preferences. However, demonstration exacerbates the user fatigue problem because it is more taxing than exhibiting preferences. The system compensates for this by retaining and reusing the user demonstration, similar in spirit to user modeling. The system is exercised on a robot locomotion and obstacle avoidance task that has an obvious local optimum. The user demonstration is provided through low-level control. The system is compared against a high-level fitness function that is susceptible to becoming trapped by a local optimum and a mid-level fitness function designed to remove the local optimum. We show that our proposed system outperforms most variants of these completely automatic methods, providing further evidence that Evolutionary Robotics (ER) can benefit by combining the intuitions of inexpert human users with the search capabilities of computers.::::::Published::::::http://www.cs.uvm.edu/~jbongard/papers/2013_CEC_Celis.pdf
Combining Fitness-based Search and User Modeling in Evolutionary Robotics:::Methodologies are emerging in many branches of computer science that demonstrate how human users and automated algorithms can collaborate on a problem such that their combined solutions outperform those produced by either humans or algorithms alone. The problem of behavior optimization in robotics seems particularly well-suited for this approach because humans have intuitions about how animals—and thus robots—should and should not behave, and can visually detect non-optimal behaviors that are trapped in local optima. Here we introduce a multiobjective approach in which a surrogate user (which stands in for a human user) deflects search away from local optima and a traditional fitness function eventually leads search toward the global optimum. We show that this approach produces superior solutions for a deceptive robotics problem compared to a similar search method that is guided by just a surrogate user or just a fitness function.::::::Published::::::http://www.cs.uvm.edu/~jbongard/papers/2013_GECCO_Bongard.pdf
On the Relationship Between Environmental and Morphological Complexity in Evolved Robots:::The principles of embodied cognition dictate that intelligent behavior must arise out of the coupled dynamics of an agent’s brain, body, and environment. While the relationship between controllers and morphologies (brains and bodies) has been investigated, little is known about the interplay between morphological complexity and the complexity of a given task environment. It is hypothesized that the morphological complexity of a robot should increase commensurately with the complexity of its task environment. Here this hypothesis is tested by evolving robot morphologies in a simple environment and in more complex environments. More complex robots tend to evolve in the more complex environments lending support to this hypothesis. This suggests that gradually increasing the complexity of task environments may provide a principled approach to evolving more complex robots.::::::Published::::::http://www.cs.uvm.edu/~jbongard/papers/2012_GECCO_Auerbach.pdf
On the Relationship Between Environmental and Mechanical Complexity in Evolved Robots:::According to the principles of embodied cognition, intelligent behavior must arise out of the coupled dynamics of an agent’s brain, body, and environment. This suggests that the morphological complexity of a robot should scale in relation to the complexity of its task environment. This idea is supported by recent work, which demonstrated that when evolving robot morphologies in simple and complex environments more complex robot morphologies do tend to evolve in more complex environments. Here this idea is extended to examining the mechanical complexity of evolved robots. Counter to intuition it is found that the mechanical complexity decreases in more complex environments.::::::Published::::::http://www.cs.uvm.edu/~jbongard/papers/2012_ALife_Auerbach.pdf
Accelerating Human-Computer Collaborative Search through Learning Comparative and Predictive User Models:::Interactive Evolutionary Algorithms (IEAs) are one of the few systems in which a human user and a computer algorithm are collaboratively working on a problem. To turn a basic IEA into the start of a Human-Computer Collaborative Computational system we have developed a system called The Approximate User (TAU). With TAU, as the user interacts with the IEA a model of the user’s preferences is constructed and continually refined and it is this user-model which drives search. Here two variations of a user-modeling approach are compared to determine if this approach can accelerate IEA search. The two user-modeling approaches compared are: 1. learning a classifier which correctly determines which of two designs is better; and 2. learning a model which predicts a fitness score. Rather than having people do the user-testing, we propose the use of a simulated user as an easier means to test IEAs. Both variants of the TAU IEA are compared against a basic IEA and it is shown that TAU is up to 2.7 times faster and 15 times more reliable at producing near optimal results.::::::Published::::::http://www.cs.uvm.edu/~jbongard/papers/2012_GECCO_Hornby.pdf
Learning Comparative User Models for Accelerating Human-Computer Collaborative Search:::Interactive Evolutionary Algorithms (IEAs) are a powerful explorative search technique that utilizes human input to make subjective decisions on potential problem solutions. But humans are slow and get bored and tired easily, limiting the usefulness of IEAs. Here we describe our system which works toward overcoming these problems, The Approximate User (TAU), and also a simulated user as a means to test IEAs. With TAU, as the user interacts with the IEA a model of the user’s preferences is constructed and continually refined and this model is what is used as the fitness function to drive evolutionary search. The resulting system is a step toward our longer term goal of building a human-computer collaborative search system. In comparing the TAU IEA against a basic IEA it is found that TAU is 2.5 times faster and 15 times more reliable at producing near optimal results.::::::Published::::::http://www.cs.uvm.edu/~jbongard/papers/2012_Evostar_Hornby.pdf
Evolving Complete Robots with CPPN-NEAT: The Utility of Recurrent Connections:::This paper extends prior work using Compositional Pattern Producing Networks (CPPNs) as a generative encoding for the purpose of simultaneously evolving robot morphology and control. A method is presented for translating CPPNs into complete robots including their physical topologies, sensor placements, and embedded, closed-loop, neural network control policies. It is shown that this method can evolve robots for a given task. Additionally it is demonstrated how the performance of evolved robots can be significantly improved by allowing recurrent connections within the underlying CPPNs. The resulting robots are analyzed in the hopes of answering why these recurrent connections prove to be so beneficial in this domain. Several hypotheses are discussed, some of which are refuted from the available data while others will require further examination.::::::Published::::::http://www.cs.uvm.edu/~jbongard/papers/2011_GECCO_Auerbach.pdf
Spontaneous Evolution of Structural Modularity in Robot Neural Network Controllers:::In order to evolve large robot controllers for increasingly complex tasks, fully connected neural networks are not feasible. However, manually designing sparse neural connectivity is not intuitive, and thus should be placed under evolutionary control. Here I show how spontaneous structural modularity can arise in the connectivity of evolved robot controllers if the controllers are boolean networks, and are selected to converge on point attractors that correspond to successful robot behaviors.::::::Published::::::http://www.cs.uvm.edu/~jbongard/papers/2011_GECCO1_Bongard.pdf
