Aggressive shadowing of a low-dimensional model of atmospheric dynamics:::Predictions of the future state of the Earth’s atmosphere suffer from the consequences of chaos: numerical weather forecast models quickly diverge from observations as uncertainty in the initial state is amplified by nonlinearity. One measure of the utility of a forecast is its shadowing time, informally given by the period of time for which the forecast is a reasonable description of reality. The present work uses the Lorenz '96 coupled system, a simplified nonlinear model of atmospheric dynamics, to extend a recently developed technique for lengthening the shadowing time of a dynamical system. Ensemble forecasting is used to make forecasts with and without inflation, a method whereby the ensemble is regularly expanded artificially along dimensions whose uncertainty is contracting. The first goal of this work is to compare model forecasts, with and without inflation, to a true trajectory created by integrating a modified version of the same model. The second goal is to establish whether inflation can increase the maximum shadowing time for a single optimal member of the ensemble. In the second experiment the true trajectory is known a priori, and only the closest ensemble members are retained at each time step, a technique known as stalking. Finally, a targeted inflation is introduced to both techniques to reduce the number of instances in which inflation occurs in directions likely to be incommensurate with the true trajectory. Results varied for inflation, with success dependent upon the experimental design parameters (e.g. size of state space, inflation amount). However, a more targeted inflation successfully reduced the number of forecast degradations without significantly reducing the number of forecast improvements. Utilized appropriately, inflation has the potential to improve predictions of the future state of atmospheric phenomena, as well as other physical systems.:::http://www.uvm.edu/~cdanfort/main/publications_files/2012-ross-physica.jpg:::Published::::::http://www.sciencedirect.com/science/article/pii/S0167278911003411
A Numerical Investigation of 3-D Flow Regimes in a Toroidal Natural Convection Loop:::Transient laminar natural convection regimes occurring in a thermal convection loop heated from below and cooled from above are investigated numerically for a wide range of Rayleigh numbers spanning the interval from 10^3 to 2.6 × 10^7. In the model system, the lower half of the loop is heated and maintained at a constant high temperature, while the upper half is cooled and maintained at a constant low temperature. A three-dimensional numerical model based on the finite volume method is used to solve the system of governing flow equations. Simulations are performed using water as the working fluid (Pr = 5.83) and detailed numerical results are presented and discussed for conduction, steady convection, and unsteady flow regimes. Although this subject has attracted researchers for decades, there have been no detailed three-dimensional numerical simulations of the dynamics of flow in the thermal convection loop. The objective of the present study is to fill this gap by presenting the temporal evolution of the velocity and temperature fields at key locations within the system. Emphasis is given to the analysis of dynamical behavior of the flow during the unsteady regime. The complexity of flow in the loop, which is characterized by vertical structures and flow recirculation, is visualized for the first time by performing detailed 3-D numerical simulations.:::http://www.uvm.edu/~cdanfort/main/publications_files/2011-ridouane-ijhmt.jpg:::Published::::::http://www.sciencedirect.com/science/article/pii/S0017931011004510
The interplay of chaos between the terrestrial and giant planets:::We report on some simple experiments on the nature of chaos in our planetary system. We make the following interesting observations. First, we look at the system of Sun   four Jovian planets as an isolated five-body system interacting only via Newtonian gravity. We find that if we measure the Lyapunov time of this system across thousands of initial conditions all within observational uncertainty, then the value of the Lyapunov time seems relatively smooth across some regions of initial condition space, while in other regions it fluctuates wildly on scales as small as we can reliably measure using numerical methods. This probably indicates a fractal structure of Lyapunov exponents measured across initial condition space. Then, we add the four inner terrestrial planets and several post-Newtonian corrections such as general relativity into the model. In this more realistic Sun   eight-planet system, we find that the above structure of chaos for the outer planets becomes uniformly chaotic for almost all planets and almost all initial conditions, with a Lyapunov time-scale of about 5–20 Myr. This seems to indicate that the addition of the inner planets adds more chaos to the system. Finally, we show that if we instead remove the outer planets and look at the isolated five-body system of the Sun   four terrestrial planets, then the terrestrial planets alone show no evidence of chaos at all, over a large range of initial conditions inside the observational error volume. We thus conclude that the uniformity of chaos in the outer planets comes not from the inner planets themselves, but from the interplay between the outer and inner ones. Interestingly, however, there exist rare and isolated initial conditions for which one individual outer planetary orbit may appear integrable over a 200-Myr time-scale, while all the other planets simultaneously appear chaotic.:::http://www.uvm.edu/~cdanfort/main/publications_files/2010-hayes-mnras.jpg:::Published::::::http://onlinelibrary.wiley.com/doi/10.1111/j.1365-2966.2010.17027.x/abstract
A 2-D numerical study of chaotic &#64258;ow in a natural convection loop:::This paper numerically investigates the nonlinear dynamics of the unstable convection regime of the thermal convection loop, an experimental analogue of the Lorenz model. The lower half of the toroidal loop is heated and maintained at a constant high temperature, while the upper half is cooled at a constant low temperature. Subject to the proper boundary conditions, the system of governing equations is solved using a finite volume method. The numerical simulations are performed for water corresponding to Pr = 5.83 and Rayleigh number varying from 1000 to 150,000. In the case of a loop heated from below and cooled from above, it has been demonstrated theoretically and experimentally in the literature that multiple flow regimes are possible. Numerical results in terms of streamlines, isotherms, and local heat flux distributions along the walls are presented for each flow regime. Although several studies have investigated the chaotic regime of convection loops, there have been no detailed numerical simulations of the dynamics of flow reversals. Fine-scale flow behavior during the transition from one flow direction to another is illustrated by the temporal evolution of temperature distribution, mass flow rate, and local heat flux at selected locations in the system. Issues related to the observed Kelvin–Helmholtz instabilities are discussed.:::http://www.uvm.edu/~cdanfort/main/publications_files/2009-ridouane-ijhmt.jpg:::Published::::::http://www.sciencedirect.com/science/article/pii/S0017931009005432
Accounting for Model Errors in Ensemble Data Assimilation:::This study addresses the issue of model errors with the ensemble Kalman filter. Observations generated from the NCEP–NCAR reanalysis fields are assimilated into a low-resolution AGCM. Without an effort to account for model errors, the performance of the local ensemble transform Kalman filter (LETKF) is seriously degraded when compared with the perfect-model scenario. Several methods to account for model errors, including model bias and system noise, are investigated. The results suggest that the two pure bias removal methods considered [Dee and Da Silva (DdSM) and low dimensional (LDM)] are not able to beat the multiplicative or additive inflation schemes used to account for the effects of total model errors. In contrast, when the bias removal methods are augmented by additive noise representing random errors (DdSM  and LDM ), they outperform the pure inflation schemes. Of these augmented methods, the LDM , where the constant bias, diurnal bias, and state-dependent errors are estimated from a large sample of 6-h forecast errors, gives the best results. The advantage of the LDM  over other methods is larger in data-sparse regions than in data-dense regions.:::http://www.uvm.edu/~cdanfort/main/publications_files/2009-li-mwr.jpg:::Published::::::http://journals.ametsoc.org/doi/abs/10.1175/2009MWR2766.1
Complex Dynamic Behavior During Transition in a Solid Combustion Model:::Through examples in a free-boundary model of solid combustion, this study concerns nonlinear transition behavior of small disturbances of front propagation and temperature as they evolve in time. This includes complex dynamics of period doubling, and quadrupling, and it eventually leads to chaotic oscillations. Within this complex dynamic domain we also observe a period six-folding. Both asymptotic and numerical solutions are studied.We show that for special parameters our asymptotic method with some dominant modes captures the formation of coherent structures. Finally, we discuss possible methods to improve our prediction of the solutions in the chaotic case.:::http://www.uvm.edu/~cdanfort/main/publications_files/2009-yu-complexity.jpg:::Published::::::http://onlinelibrary.wiley.com/doi/10.1002/cplx.20268/abstract
Dynamic Structure of Networks Updated According to Simple, Local Rules:::While most studies of deterministic network growth have been of one- or two-case models, here a more diverse and comprehensive method of deterministic network evolution is presented. The range of observed behavior is classified and the underlying causes of the various types of growth are investigated. The potential for prediction of the different types of network growth is also examined. It is discovered that a wide variety of behavior can be produced by a simple evolutionary setup and that the networks resulting from this method of evolution warrant further study.:::http://www.uvm.edu/~cdanfort/main/publications_files/2009-morrow-pre.jpg:::Published::::::http://journals.aps.org/pre/abstract/10.1103/PhysRevE.80.016103
The Impact of Uncertainty in a Blood Coagulation Model:::Deterministic mathematical models of biochemical processes operate as if the empirically derived rate constants governing the dynamics are known with certainty. Our objective in this study was to explore the sensitivity of a deterministic model of blood coagulation to variations in the values of its 44 rate constants. This was accomplished for each rate constant at a given time by defining a normalized ensemble standard deviation that accounted for the sensitivity of the predicted concentration of each protein species to variation in that rate constant (from 10 to 1000% of the accepted value). A mean coefficient of variation derived from the normalized ensemble standard deviation values for all protein species was defined to quantify the overall variation introduced into the model's predictive capacity at that time by the assumed uncertainty in that rate constant. A time-average value of the coefficient of variation over the 20-min simulation for each rate constant was then used to rank rate constants. The model's predictive capacity is particularly sensitive (50% of the aggregate variation) to uncertainty in five rate constants involved in the regulation of the formation and function of the factor VIIa–tissue factor complex. Therefore, our analysis has identified specific rate constants to which the predictive capability of this model is most sensitive and thus where improvements in measurement accuracy will yield the greatest increase in predictive capability.:::http://www.uvm.edu/~cdanfort/main/publications_files/2009-danforth-blood.jpg:::Published::::::http://imammb.oxfordjournals.org/content/26/4/323.abstract?keytype=ref
Impact of Online Empirical Model Correction on Nonlinear Error Growth:::The purpose of this study is to compare two methods of correcting the bias of a GCM; namely statistical correction performed a posteriori (offline) as a function of forecast length, and correction done within the model integration (online). The model errors of a low resolution GCM are estimated by the 6-hour forecast residual averaged over several years and used to correct the model. Both the offline and online corrections substantially reduce the model bias when applied to independent data. Their performance in correcting the model error is comparable at all lead times, but for lead times longer than 1-day the online corrected forecasts have smaller RMS forecast errors and larger anomaly correlations than offline corrected forecasts. These results indicate that the online correction reduces not only the growth of the bias but also the nonlinear growth of non-constant (state-dependent and random) forecast errors during the model integration.:::http://www.uvm.edu/~cdanfort/main/publications_files/2009-danforth-grl.jpg:::Published::::::http://onlinelibrary.wiley.com/doi/10.1029/2008GL036239/abstract
Using Singular Value Decomposition to Parameterize State-Dependent Model Errors:::The purpose of the present study is to use a new method of empirical model error correction, developed by Danforth et al. in 2007, based on estimating the systematic component of the nonperiodic errors linearly dependent on the anomalous state. The method uses singular value decomposition (SVD) to generate a basis of model errors and states. It requires only a time series of errors to estimate covariances and uses negligible additional computation during a forecast integration. As a result, it should be suitable for operational use at a relatively small computational expense. The method is tested with the Lorenz ’96 coupled system as the truth and an uncoupled version of the same system as a model. The authors demonstrate that the SVD method explains a significant component of the effect that the model’s unresolved state has on the resolved state and shows that the results are better than those obtained with Leith’s empirical correction operator. The improvement is attributed to the fact that the SVD truncation effectively reduces sampling errors. Forecast improvements of up to 1000% are seen when compared with the original model. The improvements come at the expense of weakening ensemble spread.:::http://www.uvm.edu/~cdanfort/main/publications_files/2008-danforth-jas.jpg:::Published::::::http://journals.ametsoc.org/doi/abs/10.1175/2007JAS2419.1
Estimating and Correcting Global Weather Model Error:::The purpose of the present study is to explore the feasibility of estimating and correcting systematic model errors using a simple and efficient procedure, inspired by papers by Leith as well as DelSole and Hou, that could be applied operationally, and to compare the impact of correcting the model integration with statistical corrections performed a posteriori. An elementary data assimilation scheme (Newtonian relaxation) is used to compare two simple but realistic global models, one quasigeostrophic and one based on the primitive equations, to the NCEP reanalysis (approximating the real atmosphere). The 6-h analysis corrections are separated into the model bias (obtained by time averaging the errors over several years), the periodic (seasonal and diurnal) component of the errors, and the nonperiodic errors. An estimate of the systematic component of the nonperiodic errors linearly dependent on the anomalous state is generated.Forecasts corrected during model integration with a seasonally dependent estimate of the bias remain useful longer than forecasts corrected a posteriori. The diurnal correction (based on the leading EOFs of the analysis corrections) is also successful. State-dependent corrections using the full-dimensional Leith scheme and several years of training actually make the forecasts worse due to sampling errors in the estimation of the covariance. A sparse approximation of the Leith covariance is derived using univariate and spatially localized covariances. The sparse Leith covariance results in small regional improvements, but is still computationally prohibitive. Finally, singular value decomposition is used to obtain the coupled components of the correction and forecast anomalies during the training period. The corresponding heterogeneous correlation maps are used to estimate and correct by regression the state-dependent errors during the model integration. Although the global impact of this computationally efficient method is small, it succeeds in reducing state-dependent model systematic errors in regions where they are large. The method requires only a time series of analysis corrections to estimate the error covariance and uses negligible additional computation during a forecast. As a result, it should be suitable for operational use at relatively small computational expense.:::http://www.uvm.edu/~cdanfort/main/publications_files/2007-danforth-mwr.jpg:::Published::::::http://journals.ametsoc.org/doi/abs/10.1175/MWR3289.1
Making Forecasts for Chaotic Physical Processes:::Making a prediction for a chaotic physical process involves specifying the probability associated with each possible outcome. Ensembles of solutions are frequently used to estimate this probability distribution. However, for a typical chaotic physical system H and model L of that system, no solution of L remains close to H for all time. We propose an alternative. This Letter shows how to inflate or systematically perturb the ensemble of solutions of L so that some ensemble member remains close to H for orders of magnitude longer than unperturbed solutions of L. This is true even when the perturbations are significantly smaller than the model error.:::http://www.uvm.edu/~cdanfort/main/publications_files/2006-danforth-prl.jpg:::Published::::::http://journals.aps.org/prl/abstract/10.1103/PhysRevLett.96.144102
National Survey Respondents as Agents in a Model of Plug-In Hybrid Electric Vehicle Adoption:::::::::Unpublished::::::
Analysis of a consumer survey on plug-in hybrid electric vehicles:::Plug-in Hybrid Electric Vehicles (PHEVs) show potential to reduce greenhouse gas (GHG) emissions, increase fuel efficiency, and offer driving ranges that are not limited by battery capacity. However, these benefits will not be realized if consumers do not adopt this new technology. We administered a survey to 1000 stated U.S. residents, using Amazon Mechanical Turk, to better understand factors influencing the potential for PHEV market penetration. Our analysis of the survey results reveals quantitative patterns and correlations that expand the existing literature. For example, respondents who felt most strongly about reducing U.S. transportation energy consumption and cutting greenhouse gas emissions had, respectively, 71 and 44 times greater odds of saying they would consider purchasing a compact PHEV than those who felt least strongly about these issues. However, even the most inclined to consider a compact PHEV were not generally willing to pay more than a few thousand U.S. dollars extra for the sticker price. Consistent with prior research, we found that financial and battery-related concerns remain major obstacles to widespread PHEV market penetration. Our results may help inform governmental policies, manufacturer pricing and marketing strategies to promote consumer adoption of PHEVs.::::::Unpublished::::::http://www.cs.uvm.edu/~meppstei/personal/PHEVSurveyPaperAsSubmittedTRpartA.pdf
Minimization of Cost, Sediment Load, and Sensitivity to Climate Change in a Watershed Management Application:::One challenge of climate change adaptation is to design watershed-based stormwater management plans that meet current total maximum daily load targets and also take into consideration anticipated changes in future precipitation patterns. We present a multi-scale, multiobjective framework for generating a diverse family of stormwater best management practice (BMP) plans for entire watersheds. Each of these alternative BMP configurations are non-dominated by any other identified solution with respect to cost of the implementation of the management plan and sediment loading predicted at the outflow of the watershed; those solutions are then pruned with respect to dominance in sensitivity to predicted changes in precipitation patterns. We first use GIS data to automatically precompute a set of cost-optimal BMP configurations for each subwatershed, over its entire range of possible treatment levels. We then formulate each solution as a real-valued vector of treatment levels for the subwatersheds and employ a staged multiobjective optimization approach using differential evolution to generate sets of non- dominated solutions. Finally, selected solutions are mapped back to the corresponding preoptimized BMP configurations for each subwatershed. The integrated method is demonstrated on the Bartlett Brook mixed-used impaired watershed in South Burlington, VT, and patterns in BMP configurations along the non-dominated front are investigated. Watershed managers and other stakeholders could use this approach to assess the relative trade-offs of alternative stormwater BMP configurations.::::::Published::::::http://cs.uvm.edu/~meppstei/personal/EnvModAndSoft2013.pdf
Team Learning for Healthcare Quality Improvement:::In organized healthcare quality improvement collaboratives (QICs), teams of practitioners from different hospitals exchange information on clinical practices with the aim of improving health outcomes at their own institutions. However, what works in one hospital may not work in others with different local contexts because of nonlinear interactions among various demographics, treatments, and practices. In previous studies of collaborations where the goal is a collective problem solving, teams of diverse individuals have been shown to outperform teams of similar individuals. However, when the purpose of collaboration is knowledge diffusion in complex environments, it is not clear whether team diversity will help or hinder effective learning. In this paper, we rst use an agent-based model of QICs to show that teams comprising similar individuals outperform those with more diverse individuals under nearly all conditions, and that this advantage increases with the complexity of the landscape and level of noise in assessing performance. Examination of data from a network of real hospitals provides encouraging evidence of a high degree of similarity in clinical practices, especially within teams of hospitals engaging in QIC teams. However, our model also suggests that groups of similar hospitals could benet from larger teams and more open sharing of details on clinical outcomes than is currently the norm. To facilitate this, we propose a secure virtual collaboration system that would allow hospitals to efciently identify potentially better practices in use at other institutions similar to theirs without any institutions having to sacrice the privacy of their own data. Our results may also have implications for other types of data-driven diffusive learning such as in personalized medicine and evolutionary search in noisy, complex combinatorial optimization problems.::::::Published::::::http://ieeexplore.ieee.org/stamp/stamp.jsp?tp=
Discovering Design Principles from Dominated Solutions:::Important progress has been made by many researchers in extracting fundamental designprinciples from patterns in design parameters along the nondominated front generated by evolutionary algorithms in biobjective optimization problems. However, to the best of our knowledge, no attention has been given to discovering design principles from the wealth of additional information available from patterns in dominated solutions. To explore the same, we use heatmaps of dominated solutions to visualize how relevant variables self-organize with respect to the objectives throughout the feasible region. We overlay ceteris paribus lines on these heatmaps to show how the objective values change when a given design variable is varied while all others are held constant. We use three biobjective optimization problems to demonstrate various ways in which these visualization techniques can provide additional useful information beyond that which can be determined from the nondominated front. Specically, we investigate a simple two-member truss design problem, a simple welded beam design problem, and a real-world watershed management design problem to illustrate: 1) how principles derived from the nondominated front alone can be misleading; 2) how new principles can be derived from the dominated solutions; and 3) how nondominated solutions can often be fragile with respect to assumptions about uncertain external forcing conditions, whereas solutions a short distance inside the front are often much more robust.::::::Published::::::http://ieeexplore.ieee.org/stamp/stamp.jsp?tp=
