Fluorescence-enhanced optical imaging of large phantoms using single and simultaneous dual point illumination geometries:::Fluorescence-enhanced optical tomography is typically performed using single point illumination and multiple point collection measurement geometry. Single point illumination is often insufficient to illuminate greater volumes of large phantoms and results in an inadequate fluorescent signal to noise ratio (SNR) for the majority of measurements. In this work, the use of simultaneous multiple point illumination geometry is proposed for acquiring a large number of fluorescent measurements with a sufficiently high SNR. As a feasibility study, dual point excitation sources, which are in-phase, were used in order to acquire surface measurements and perform three-dimensional reconstructions on phantoms of large volume and/or significant penetration depth. Measurements were acquired in the frequency–domain using a modulated intensified CCD imaging system under different experimental conditions of target depth (1.4–2.8 cm deep) with a perfect uptake optical contrast. Three-dimensional reconstructions of the fluorescence absorption from the dual point illumination geometry compare well with the reconstructions from the single point illumination geometry. Targets located up to 2 cm deep were located successfully, establishing the feasibility of reconstructions from simultaneous multiple point excitation sources. With improved excitation light rejection, multiple point illumination geometry may prove useful in reconstructing more challenging domains containing deeply embedded targets. Image quality assessment tools are required to determine the optimal measurement geometry for the largest set off imaging tasks.::::::Published::::::http://www.cs.uvm.edu/~meppstei/personal/medphy-published-feb04.pdf
Coupled complex adjoint sensitivities for frequency-domain fluorescence tomography: theory and vectorized implementation:::We present a computationally efficient and accurate adjoint method for calculating coupled sensitivities of complex frequency-domain excitation and emission fluence to any underlying optical parameters in highly scattering media. The method is shown to be general and accurate. Novel vectorized implementations for finite element global matrix assembly and adjoint sensitivity calculations are shown to speed up calculations by orders of magnitude over traditional loop implementations, thereby making least-squares approaches to fluorescence tomography computationally practical.::::::Published::::::http://www.cs.uvm.edu/~meppstei/personal/JCP03.pdf
The influence of the refractive index-mismatch at the boundaries measured in fluorescence-enhanced frequency-domain photon migration imaging:::Over the past decade, developments towards near-infrared (NIR) optical tomography involve the recovery of interior optical maps from boundary measurements using the first principles of light propagation models. The refractive-index mismatch parameter in the boundary condition of the light propagation model, namely the diffusion equation, can significantly impact model prediction of measurements and therefore image recovery. In this contribution, the influence of refractive-index mismatch parameter between predictions and referenced measurements of fluorescence-enhanced frequency-domain photon migration (FDPM) are established; its greater influence on emission over excitation predictions are demonstrated, and the methods to accurately determine refractive index mismatch parameter from basic principles are reviewed.::::::Published::::::http://www.cs.uvm.edu/~meppstei/personal/OptExp02.pdf
Three-dimensional, Bayesian image reconstruction from sparse and noisy data sets: Near-infrared fluorescence tomography:::A method for inverting measurements made on the surfaces of tissues for recovery of interior optical property maps is demonstrated for sparse near-infrared (NIR) fluorescence measurement sets on large tissue-simulating volumes with highly variable signal-to-noise ratio. A Bayesian minimum-variance reconstruction algorithm compensates for the spatial variability in signal-to-noise ratio that must be expected to occur in actual NIR contrast-enhanced diagnostic medical imaging. Image reconstruction is demonstrated by using frequency-domain photon migration measurements on 256-cm^3 tissue-mimicking phantoms containing none, one, or two 1-cm^3 heterogeneities with 50- to 100-fold greater concentration of Indocyanine Green dye over background levels. The spatial parameter estimate of absorption owing to the dye was reconstructed from only 160 to 296 surface measurements of emission light at 830 nm in response to incident 785-nm excitation light modulated at 100 MHz. Measurement error of acquired fluence at fluorescent emission wavelengths is shown to be highly variable. Convergence and quality of image reconstructions are improved by Bayesian conditioning incorporating (i) experimentally determined measurement error variance, (ii) recursively updated estimates of parameter uncertainty, and (iii) dynamic zonation. The results demonstrate that, to employ NIR fluorescence-enhanced optical imaging for large volumes, reconstruction approaches must account for the large range of signal-to-noise ratio associated with the measurements.::::::Published::::::http://www.cs.uvm.edu/~meppstei/personal/PNAS02.pdf
Error Consideration in Contrast-Enhanced Three Dimensional Optical Tomography:::We present three-dimensional tomographic images of the absorption coefficient that is due to the presence of a fluorophore reconstructed from frequency domain fluence measurements of a tissue phantom containing a single, fluorescence contrast-enhanced inclusion. We show that such a reconstruction may be improved when the importance of measurement error correlations between relative phase shift and amplitude is assessed and when measurements are preprocessed to reduce the magnitude and the bias of system error.::::::Published::::::http://www.opticsinfobase.org/ol/abstract.cfm?uri=ol-26-10-704
3-D Bayesian optical image reconstruction with domain decomposition:::Most current efforts in near-infrared optical tomography are effectively limited to two-dimensional reconstructions due to the computationally intensive nature of full three-dimensional (3-D) data inversion. Previously, we described a new computationally efficient and statistically powerful inversion method APPRIZE (automatic progressive parameter-reducing inverse zonation and estimation). The APPRIZE method computes minimum-variance estimates of parameter values (here, spatially variant absorption due to a fluorescent contrast agent) and covariance, while simultaneously estimating the number of parameters needed as well as the size, shape, and location of the spatial regions that correspond to those parameters. Estimates of measurement and model error are explicitly incorporated into the procedure and implicitly regularize the inversion in a physically based manner. The optimal estimation of parameters is bounds-constrained, precluding infeasible values. In this paper, the APPRIZE method for optical imaging is extended for application to arbitrarily large 3-D domains through the use of domain decomposition. The effect of sub-domain size on the performance of the method is examined by assessing the sensitivity for identifying 112 randomly located single-voxel heterogeneities in 58 3-D domains. Also investigated are the effects of unmodeled heterogeneity in background optical properties. The method is tested on simulated frequency-domain photon migration measurements at 100 MHz in order to recover absorption maps owing to fluorescent contrast agent. This study provides a new approach for computationally tractable 3-D optical tomography.::::::Published::::::http://www.cs.uvm.edu/~meppstei/personal/tmi01.pdf
Biomedical optical tomography using dynamic parameterization and Bayesian conditioning on photon migration measurements:::Stochastic reconstruction techniques are developed for mapping the interior optical properties of tissues from exterior frequency-domain photon migration measurements at the air-tissue interface. Parameter fields of absorption cross section, fluorescence lifetime, and quantum efficiency are accurately reconstructed from simulated noisy measurements of phase shift and amplitude modulation by use of a recursive, Bayesian, minimum-variance estimator known as the approximate extended Kalman filter. Parameter field updates are followed by data-driven zonation to improve the accuracy, stability, and computational efficiency of the method by moving the system from an underdetermined toward an overdetermined set of equations. These methods were originally developed by Eppstein and Dougherty [Water Resources Res. 32, 3321 (1996)] for applications in geohydrology. Estimates are constrained to within feasible ranges by modeling of parameters as beta-distributed random variables. No arbitrary smoothing, regularization, or interpolation is required. Results are compared with those determined by use of Newton-Raphson-based inversions. The speed and accuracy of these preliminary Bayesian reconstructions suggest the near-future application of this inversion technology to three-dimensional biomedical imaging with frequency-domain photon migration.::::::Published::::::http://www.cs.uvm.edu/~meppstei/personal/AO99.pdf
Efficient 3-D data inversion: Soil characterization and moisture monitoring from crosswell GPR at a Vermont test site:::We extend our methodology for three-dimensional parameter structure and value estimation and apply it to a Vermont test site. Ground-penetrating radar (GPR) cross-well travel times are inverted for estimation of heterogeneous GPR soil velocities before and after a controlled release of salt water in the unsaturated zone. The method, which is based on an approximation of the extended Kalman filter in conjunction with data-driven zonation, automatically estimates not only distributed zone values but also the number of zones, zone geometry, and zone covariance. Resultant GPR velocity estimates are shown to reduce travel time estimation errors and to be consistent with independent cone penetrometer measurements at all five walls at the site. Comparison of velocity estimates before and after forced injection of salt water is used to detect and visualize soil moisture patterns in three dimensions. By varying the 'cluster tolerance criterion' in the data-driven zonation process, the user can obtain a desired resolution of heterogeneity (number of zones used) in the resultant model.::::::Published::::::http://www.cs.uvm.edu/~meppstei/personal/WRR98scanned.pdf
Simultaneous estimation of transmissivity values and zonation:::The extended Kalman &#64257;lter (EKF) has long been recognized as a powerful, yet computationally intensive, methodology for stochastic parameter estimation. Three improvements to traditional algorithms are presented and applied to heterogeneous transmissivity estimation. First, the costly EKF covariance updates are replaced by more ef&#64257;cient approximations. Second, the zonation structure of the distributed parameter &#64257;eld being estimated is dynamically determined and re&#64257;ned using a partitional clustering algorithm. Third, a new method of merging &#64257;rst and second moments of random &#64257;elds that have heterogeneous statistics is introduced. We apply this method, called random &#64257;eld union, as an alternative to conventional random &#64257;eld averaging for the systematic shrinking of covariance matrices as the dimensionality of the parameter space is reduced. The effects of these three improvements are examined. In applications to steady state groundwater &#64258;ow test problems, we show that the &#64257;rst and second improvements reduce the computational time requirements dramatically, while the second and third can improve the accuracy and stability of the results. The resulting integrated method is successfully applied to a larger, more realistic calibration test case under steady and cyclostationary &#64258;ow conditions (similar to regular seasonal &#64258;uctuations). When &#64258;ow is steady, the method can be viewed as iterative; when &#64258;ow is transient, the method is fully recursive.::::::Published::::::http://www.cs.uvm.edu/~meppstei/personal/96WR02283.pdf
A comparative study of PVM workstation cluster implementations of a two-phase subsurface flow model:::Four versions of a message-passing, distributed-memory, distributed-disk multicomputer application for simulating two-phase fluid flow in porous media are studied. The FORTRAN 77 finite element code, solved in parallel using an iterative domain-decomposition method, was ported from a shared-memory multiprocessor implementation to a network of heterogeneous computers using the PVM (Parallel Virtual Machine) software system. Issues concerning the calculation of speedups in cluster computing are discussed, and the performance of the four versions is compared. Parallel efficiencies of up to nearly 60% were achieved using 17 homogeneous networked workstations; speedups were comparable to the shared-memory implementation. We conclude that network multicomputing using PVM is an attractive alternative to hardware multiprocessors for large-grained parallel implementations of computationally intensive problems in hydrology.::::::Published::::::http://search.proquest.com/docview/16643014/A8459193D6D2441FPQ/1?accountid=14679
The pit-trapping foraging strategy of the ant lion, Myrmeleon immaculatus:::Larvae of Myrmeleon immaculatus in large pits captured both large and small prey, while larvae in small pits captured only the small prey. Larvae in small pits did not respond to large ants, although they always responded by sand-flinging to small ants. Larvae in medium-sized pits often captured large ants only after prolonged and vigorous sand-flipping. Larvae in large pits usually captured large ants with relatively little sand-flipping. Pit enlargement and pit relocation in the laboratory were not significantly correlated with reduction of rations in the first 3 weeks after a pit was built. However, after a month without food, larvae on the average moved once every 10 days, built successively smaller pits, and moved longer distances before building a new pit. In the field pits were dug primarily in response to microclimatological factors and possibly edge-effects. The presence or absence of suitable prey at a site, per se, had no effect on whether or not a larva would dig a pit there. We conclude that these sit-and-wait predators have a relatively large repertoire of behavior that enhances their foraging success, and we contrast it with previously made optimal foraging models relating to pit locations, pit relocations, pit size and ant lion responses.::::::Published::::::http://link.springer.com/article/10.1007/BF00291906
Size and caste in temperature regulation by bumblebees:::Bumblebees ranging in mass from 65 mg (the smallest workers of the smallest species) to 830 mg (the largest queens of the largest species examined) maintained similar average thoracic temperatures (TsubTh) while foraging, even though the passive cooling rates of these bees over this size range varied fourfold. Although the bees regulated TsubTh between apparent lower and upper set points despite wide ranges of body size (and over wide ranges of ambient temperature), they allowed TsubTh to fluctuate between set points. The foraging activity of queens was relatively independent of ambient temperature (Tsuba), but workers (and particularly the smallest workers were often excluded at low Tsuba. Although the size-related rates of passive cooling of drones was similar to that of workers, they did not maintain the same TsubTh as workers on some kinds of flowers.::::::Published::::::http://www.jstor.org/stable/30155878
Heterothermia in foraging workers and drones of the bumblebee Bombus terricola:::While foraging from the dense inflorescences of spiraea (Spiraea latifolia) and goldenrods (Solidago sp.), both workers and drones often allowed thoracic temperature (TsubTh) to fall below the minimum for flight. The bees were physiologically capable of maintaining a high TsubTh, but the periodic decrease in TsubTh was strongly correlated with ambient temperature (Tsuba). Decreases of TsubTh were unrelated to fuel reserves carried in the honey stomach. Drones foraging from the inflorescences were more likely to have low TsubTh than workers, even though on the average they carried several times greater fuel reserves in their honey stomach. Within workers, old or parasitized (by conopid flies) individuals were more likely to forage with low TsubTh than young an unparasitized individuals. Workers, unlike drones, showed an increasing tendency to decrease TsubTh with decreasing body mass. Although the decrease in TsubTh while foraging ('torpor'), with its associated sluggishness, appears to function as an energy-conservation mechanism, it could also be a risk-averting mechanism. By maintaining a high TsubTh and flight readiness, workers can 'gamble' on the chance of finding a new food source, unlike drones who do not have the hive's energy resources to fall back on if they deplete their supply of stored fuel.::::::Published::::::http://www.jstor.org/stable/30155879
Improving Uniformity of Solution Spacing in Biobjective Evolution:::We introduce a new synergistic combination of features, some of which have previously been used individually but not together, to improve uniformity of spacing in evolved non-dominated sets, especially in biobjective problems. On five standard biobjective benchmark tests, these features are shown to enhance performance in distinct and complementary ways.::::::Published::::::http://cs.uvm.edu/~meppstei/personal/USMDE_Gecco_2013.pdf
Team Structure and Quality Improvement in Collaborative Environments:::Teams comprising diverse individuals have been shown to increase the collective creativity in jointly solving problems. However, in contexts where the purpose of collaboration is knowledge diffusion in complex environments, it is not clear whether team diversity will help or hinder effective learning. For example, in organized quality improvement collaboratives (QICs), healthcare institutions exchange information on clinical practices and outcomes with the aim of improving health outcomes at their own institutions. However, what works in one hospital may not work in others with different local contexts, due to non-linear interactions among various treatments and practices. While there is limited evidence that some QICs have resulted in improved care, it is not yet clear what factors contribute to the effectiveness of these team collaborations. In this study, we use an agent-based model to study how different strategies of team formation, including team diversity and size, affect quality improvement in simulated collaborative environments. We show that, in this context, teams comprising similar individuals outperform those with more diverse teams, and that this advantage increases with the complexity of the landscape and level of noise in assessing fitness. Furthermore, we show that larger teams of relatively homogeneous agents perform better than smaller teams, and that effective learning through team collaborations is dependent on the level of knowledge of team members’ performance levels. Thus, our results suggest that groups of similar hospitals should collaborate as a single team and openly share detailed information regarding their clinical practices and outcomes. To facilitate this, we propose a virtual collaboration framework that would allow hospitals to efficiently identify potentially better practices in use at other institutions similar to theirs, without any institutions having to sacrifice the privacy of their own data. Our results may also have implications for other types of data-driven diffusive learning, such as in personalized medicine.::::::Published::::::http://cs.uvm.edu/~meppstei/personal/CTS2013Corrected.pdf
Evolutionary Feature Selection for Classification: A Plug-In Hybrid Vehicle Adoption Application:::We present a real-world application utilizing a Genetic Algorithm (GA) for exploratory multivariate association analysis of a large consumer survey designed to assess potential consumer adoption of Plug-in Hybrid Electric Vehicles (PHEVs). The GA utilizes an intersection/union crossover operator, in conjunction with high background mutation rates, to achieve rapid multivariate feature selection. We experimented with two alternative fitness measures based on classification results of a naïve Bayes quadratic discriminant analysis; one fitness function rewarded only for correct classifications, and the other penalized for the degree of misclassification using a quadratic penalty function. We achieved high classification accuracy for three different survey outcome questions (with 3-, 5-, and 7- outcome classes, respectively). The quadratic penalty function yielded better overall results, returning smaller feature sets and overall more accurate contingency tables of predicted classes. Our results help to identify what consumer attributes best predict their likelihood of purchasing a PHEV. These findings will be used to better inform an existing agent-based model of PHEV market penetration, with the ultimate aim of helping auto manufacturers and policy makers identify leverage points in the system that will encourage PHEV market adoption.::::::Published::::::http://www.cs.uvm.edu/~meppstei/personal/GECCO_Krupa2012.pdf
Evolutionary Mining for Multivariate Associations in Large Time-Varying data sets: a Healthcare Network Application:::We introduce a new method for exploratory analysis of large data sets with time-varying features, where the aim is to automatically discover novel relationships between features (over some time period) that are predictive of any of a number of time-varying outcomes (over some other time period). Using a genetic algorithm, we co-evolve (i) a subset of predictive features, (ii) which attribute will be predicted (iii) the time period over which to assess the predictive features, and (iv) the time period over which to assess the predicted attribute. After validating the method on 15 synthetic test problems, we used the approach for exploratory analysis of a large healthcare network data set. We discovered a strong association, with 100% sensitivity, between hospital participation in multi-institutional quality improvement collaboratives during or before 2002, and changes in the risk-adjusted rates of mortality and morbidity observed after a 1-2 year lag. The results provide indirect evidence that these quality improvement collaboratives may have had the desired effect of improving health care practices at participating hospitals. The proposed approach is a potentially powerful and general tool for exploratory analysis of a wide range of time-series data sets.::::::Published::::::http://www.cs.uvm.edu/~meppstei/personal/GeccoPaperNarine2012.pdf
Differential Evolution of Constants in Genetic  Programming Improves Efficacy and Bloat:::We employ a variant of Differential Evolution (DE) for co-&#65532;evolution of real coefficients in Genetic Programming (GP). &#65532;This GP DE method is applied to 30 randomly generated symbolic regression problems of varying difficulty. Expressions were evolved on sparsely sampled points, but were evaluated for accuracy using densely sampled points over much wider ranges of inputs. The GP DE had successful runs on 25 of 30 problems, &#65532;whereas GP using Ephemeral Random Constants succeeded on only 6 and the multi-objective GP Eureqa on only 18. Although nesting DE slows down each GP generation significantly, successful GP DE runs required many fewer GP generations than the other methods and, in nearly all cases, the number of nodes in the best evolved trees were smaller in GP DE than with the other &#65532;GP methods.::::::Published::::::http://www.cs.uvm.edu/~meppstei/personal/GPDE_GECCO_LBA_Shreya2012.pdf
An Agent-Based Model for Estimating Consumer Adoption of PHEV Technology:::This study presents a prototype of a spatially-explicit and socially-embedded agent based model to study adoption of plug-in hybrid vehicle (PHEV) technology under a variety of scenarios. Heterogeneous agents decide whether or not to buy a PHEV by weighing environmental benefits and financial considerations (based on their personal driving habits, their projections of future gas prices, and how accurately they estimate fuel costs), subject to various social influences. Proof-of-concept results are presented to illustrate the types of questions which could be addressed by such a model, and how they may help to inform policy-makers and/or vehicle manufacturers. For example, our results indicate that simple web-based tools for helping consumers to more accurately estimate relative fuel costs could dramatically increase PHEV adoption.::::::Published::::::http://www.uvm.edu/~transctr/publications/TRB_2010/10-3303.pdf
