Calculation of the Autocorrelation Function of the Stochastic Single Machine Infinite Bus System:::Critical slowing down (CSD) is the phenomenon in which a system recovers more slowly from small perturbations. CSD, as evidenced by increasing signal variance and autocorrela- tion, has been observed in many dynamical systems approaching a critical transition, and thus can be a useful signal of proximity to transition. In this paper, we derive autocorrelation functions for the state variables of a stochastic single machine infinite bus system (SMIB). The results show that both autocorrelation and variance increase as this system approaches a saddle-node bifurcation. The autocorrelation functions help to explain why CSD can be used as an indicator of proximity to criticality in power systems revealing, for example, how nonlinearity in the SMIB system causes these signs to appear.::::::Unpublished::::::http://www.uvm.edu/~phines/publications/2013/ghanavati_2013.pdf
Packetized Plug-in Electric Vehicle Charge Management:::Plug-in electric vehicle (PEV) charging could cause significant strain on residential distribution systems, unless technologies and incentives are created to mitigate charging during times of peak residential consumption. This paper describes and evaluates a decentralized and ‘packetized’ approach to PEV charge management, in which PEV charging is requested and approved for time-limited periods. This method, which is adapted from approaches for bandwidth sharing in communication networks, simultaneously ensures that constraints in the distribution network are satisfied, that communication bandwidth requirements are relatively small, and that each vehicle has fair access to the available power capacity. This paper compares the performance of the packetized approach to an optimization method and a first-come, first- served (FCFS) charging scheme in a test case with a constrained 500 kVA distribution feeder and time-of-use residential electricity pricing. The results show substantial advantages for the packetized approach. The algorithm provides all vehicles with equal access to constrained resources and attains near optimal travel cost performance, with low complexity and communication requirements. The proposed method does not require that vehicles report or record driving patterns, and thus provides benefits over optimization approaches by preserving privacy and reducing computation and bandwidth requirements.::::::Unpublished::::::http://www.uvm.edu/~phines/publications/2014/rezaei_2014.pdf
Dual Graph and Random Chemistry methods for Cascading Failure Analysis:::This paper describes two new approaches to cascading failure analysis in power systems that can combine large amounts of data about cascading blackouts to produce information about the ways that cascades may propagate. In the first, we evaluate methods for representing cascading failure information in the form of a graph. We refer to these graphs as dual graphs because the vertices are the transmission lines (the physical links), rather than the more conventional approach of representing power system buses as vertices. Examples of these ideas using the IEEE 30 bus system indicate that the dual graph methods can provide useful insight into how cascades propagate. In the second part of the paper we describe a random chemistry algorithm that can search through the enormous space of possible combinations of potential component outages to efficiently find large collections of the most dangerous combinations. This method was applied to a power grid with 2896 transmission branches, and provides insight into component outages that are notably more likely than others to trigger a cascading failure. In the conclusions we discuss potential uses of these methods for power systems planning and operations.::::::Unpublished::::::http://www.uvm.edu/~phines/publications/2013/hines_2013_dg.pdf
Predicting Critical Transitions from Time Series Synchrophasor Data:::The dynamical behavior of power systems under stress frequently deviates from the predictions of deterministic models. Model-free methods for detecting signs of excessive stress before instability occurs would therefore be valuable. The mathematical frameworks of fast-slow systems and critical slowing down can describe the statistical behavior of dynamical systems that are subjected to random perturbations as they approach points of instability. This paper builds from existing literature on fast-slow systems to provide evidence that time series data alone can be useful to estimate the temporal distance of a power system to a critical transition, such as voltage collapse. Our method is based on identifying evidence of critical slowing down in a single stream of synchronized phasor measurements. Results from a single machine, stochastic infinite bus model, a three machine/nine bus system and the Western North American disturbance of 10 August 1996 illustrate the utility of the proposed method.::::::Unpublished::::::http://www.uvm.edu/~phines/publications/2012/cotilla-sanchez_2012.pdf
A Random Chemistry Algorithm for Identifying Collections of Multiple Contingencies that Initiate Cascading Failure:::This paper describes a stochastic Random Chemistry (RC) algorithm to identify large collections of multiple (n-k) contingencies that initiate large cascading failures in a simulated power system. The method requires only O(log (n)) simulations per contingency identified, which is orders of magnitude faster than random search of this combinatorial space. We applied the method to a model of cascading failure in a power network with n=2896 branches and identify 148243 unique, minimal n-k branch contingencies (2 &#8804; k &#8804; 5) that cause large cascades, many of which would be missed by using pre-contingency flows, linearized line outage distribution factors, or performance indices as screening factors. Within each n-k collection, the frequency with which individual branches appear follows a power-law (or nearly so) distribution, indicating that a relatively small number of components contribute disproportionately to system vulnerability. The paper discusses various ways that RC generated collections of dangerous contingencies could be used in power systems planning and operations.::::::Unpublished::::::http://www.uvm.edu/~phines/publications/2012/eppstein_2012.pdf
Comparing the Topological and Electrical Structure of the North American Electric Power Infrastructure:::The topological (graph) structure of complex networks often provides valuable information about the performance and vulnerability of the network. However, there are multiple ways to represent a given network as a graph. Electric power transmission and distribution networks have a topological structure that is straightforward to represent and analyze as a graph. However, simple graph models neglect the comprehensive connections between components that result from Ohm's and Kirchhoff's laws. This paper describes the structure of the three North American electric power interconnections, from the perspective of both topological and electrical connectivity. We compare the simple topology of these networks with that of random (Erdos and Renyi, 1959), preferential-attachment (Barabasi and Albert, 1999) and small-world (Watts and Strogatz, 1998) networks of equivalent sizes and find that power grids differ substantially from these abstract models in degree distribution, clustering, diameter and assortativity, and thus conclude that these topological forms may be misleading as models of power systems. To study the electrical connectivity of power systems, we propose a new method for representing electrical structure using electrical distances rather than geographic connections. Comparisons of these two representations of the North American power networks reveal notable differences between the electrical and topological structure of electric power networks.::::::Unpublished:::http://arxiv.org/abs/1105.0214:::
Risk Assessment of Cascading Outages: Methodologies and Challenges:::Cascading outages can cause large blackouts, and a variety of methods are emerging to study this challenging topic. The Task Force on Understanding, Prediction, Mitigation, and Restoration of Cascading Failures, under the IEEE PES Computer Analytical Methods Subcommittee (CAMS), seeks to consolidate and review the progress of the field towards methods and tools of assessing the risk of cascading failure. This paper discusses the challenges of cascading failure and summarizes a variety of state-of-the-art analysis and simulation methods, including analyzing observed data, and simulations relying on various probabilistic, deterministic, approximate, and heuristic approaches. Limitations to the interpretation and application of analytical results are highlighted, and directions and challenges for future developments are discussed.::::::Unpublished::::::http://ieeexplore.ieee.org/xpls/abs_all.jsp?arnumber=6112807
Cascading Failures: Extreme Properties of Large Blackouts in the Electric Grid:::Power grids are almost universally agreed to be complex systems, which means that it is not possible to fully understand the grid by just looking at its parts. Power grids, which we define here to include all of the physical infrastructure and human individuals and organizations that jointly work to produce, distribute and consume electricity, have many properties that are common to other complex systems. Like the international financial system, power grids are operated by many millions of physical (hardware/software) and human agents. Like the Internet, power systems are frequently subjected to both random failure and malicious attack. Like the weather systems interacting to form hurricanes, there are strong, non-linear connections among the components, and between the components and society at large. And power systems occasionally exhibit spectacularly large, and costly, failures. This essay attempts to help us to understand these failures by highlighting key mathematical properties of cascading failures in complex systems in general, and in power grids in particular. We focus particularly on the mathematical challenges of measuring cascading failure risk in large power grids, and discuss some techniques that may provide better information to power grid operators regarding cascading failure risk.::::::Published::::::http://www.mathaware.org/mam/2011/essays/complexsystemsHines.pdf
Do topological models provide good information about vulnerability in electric power networks?:::In order to identify the extent to which results from topological graph models are useful for modeling vulnerability in electricity infrastructure, we measure the susceptibility of power networks to random failures and directed attacks using three measures of vulnerability: characteristic path lengths, connectivity loss and blackout sizes. The first two are purely topological metrics. The blackout size calculation results from a model of cascading failure in power networks. Testing the response of 40 areas within the Eastern US power grid and a standard IEEE test case to a variety of attack/failure vectors indicates that directed attacks result in larger failures using all three vulnerability measures, but the attack vectors that appear to cause the most damage depend on the measure chosen. While our topological and power grid model results show some trends that are similar, there is only a mild correlation between the vulnerability measures for individual simulations. We conclude that evaluating vulnerability in power networks using purely topological metrics can be misleading.::::::Published:::http://arxiv.org/abs/1002.2268:::
Cascading failures in power grids:::Power grids are complex dynamical systems, and because of this complexity it is unlikely that we will completely eliminate blackouts. However, there are things that can be done to reduce the average size and cost of these blackouts. In this article we described two strategies that hold substantial promise for reducing the size and cost of blackouts. Both reciprocal altruism and survivability respect the necessarily decentralized nature of power grids. Both strategies can be implemented within the context of the existing physical infrastructure of the power grids,which is important because dramatic changes to the physical infrastructure are prohibitively expensive. However, additional engineering and innovation will be needed to bring strategies such as these to implementation and to create power grids with smaller, less costly blackouts.::::::Published::::::http://ieeexplore.ieee.org/xpl/articleDetails.jsp?arnumber=5235532
Reciprocally Altruistic Agents for the Mitigation of Cascading Failures in Power Grids:::Cascading failures in electrical power networks often come with disastrous consequences. A variety of schemes for mitigating cascading failures exist, but the vast majority depend upon centralised control architectures. Centralised designs are frequently more susceptible to communications latency and bandwidth limitations and can be vulnerable to random failures and directed attacks. This paper proposes a decentralised approach. We place control agents at each substation in a power network, each of which uses decentralised Model Predictive Control (MPC) to select emergency control actions. When making decisions, the control agents consider not only their own goals, but also the goals of nearby agents. Thus the agents act with Reciprocal Altruism (RA). Results from simulations of extreme cascading failures within the IEEE 300 bus test network indicate that this approach can dramatically reduce the average size and social cost of large cascading failures. Simulations also show that the bandwidth required for message passing is well within the limits of current technology.::::::Published::::::http://www.inderscience.com/offer.php?id=29113
Large Blackouts in North America: Historical Trends and Policy Implications:::Using data from the North American Electric Reliability Council (NERC) for 1984–2006, we find several trends. We find that the frequency of large blackouts in the United States has not decreased over time, that there is a statistically significant increase in blackout frequency during peak hours of the day and during late summer and mid-winter months (although non-storm-related risk is nearly constant through the year) and that there is strong statistical support for the previously observed power-law statistical relationship between blackout size and frequency. We do not find that blackout sizes and blackout durations are significantly correlated. These trends hold even after controlling for increasing demand and population and after eliminating small events, for which the data may be skewed by spotty reporting. Trends in blackout occurrences, such as those observed in the North American data, have important implications for those who make investment and policy decisions in the electricity industry. We provide a number of examples that illustrate how these trends can inform benefit-cost analysis calculations. Also, following procedures used in natural disaster planning we use the observed statistical trends to calculate the size of the 100-year blackout, which for North America is 186,000 MW.::::::Published::::::http://www.sciencedirect.com/science/article/pii/S0301421509005667
Controlling Cascading Failures with Cooperative Autonomous Agents:::Cascading failures in electricity networks often result in large blackouts with severe social consequences. A cascading failure typically begins with one or more equipment outages that cause operating constraint violations. When violations persist in a network, they can trigger additional outages which in turn may cause further violations. This paper proposes a method for limiting the social costs of cascading failures by eliminating violations before dependent outages occur. Specifically, our approach places one autonomous software agents at each bus of a power network, each of which is tasked with solving the global control problem with limited data and communication. Each agent builds a simplified model of the network based on locally available data and solves its local problem using model predictive control and cooperation. Through extensive simulations with IEEE test networks, we find that the autonomous agent design meets its goals with limited communication. Experiments also demonstrate that allowing agents to cooperate can vastly improve system performance.::::::Published::::::http://www.inderscience.com/offer.php?id=11551
Estimating the Impact of Electric Vehicle Smart Charging on Distribution Transformer Aging:::This paper describes a method for estimating the impact of plug-in electric vehicle (PEV) charging on overhead distribution transformers, based on detailed travel demand data and under several different schemes for mitigating overloads by shifting PEV charging times (smart charging). The paper also presents a new smart charging algorithm that manages PEV charging based on estimated transformer temperatures. We simulated the varied behavior of drivers from the 2009 National Household Transportation Survey, and transformer temperatures based an IEEE standard dynamic thermal model. Results are shown for Monte Carlo simulation of a 25 kVA overhead distribution transformer, with ambient temperature data from hot and cold climate locations, for uncontrolled and several smart-charging scenarios. These results illustrate the substantial impact of ambient temperatures on distribution transformer aging, and indicate that temperature-based smart charging can dramatically reduce both the mean and variance in transformer aging without substantially reducing the frequency with which PEVs obtain a full charge. Finally, the results indicate that simple smart charging schemes, such as delaying charging until after midnight can actually increase, rather than decrease, transformer aging.::::::Unpublished::::::http://ieeexplore.ieee.org/xpl/articleDetails.jsp?arnumber=6378418
Estimating the impact of fuel-switching between liquid fuels and electricity under electricity-sector carbon&#8208;pricing schemes:::Switching from liquid fuels to electricity in the transportation and heating sectors can result in greenhouse gas emissions reductions. These reductions are maximized when electricity-sector carbon emissions are constrained through policy measures. We use a linear optimization, generation expansion/dispatch model to evaluate the impact of increased electricity demand for plug-in electric vehicle charging on the generating portfolio, overall generating fuel mix, and the costs of electricity generation. We apply this model to the PJM Interconnect and ISO-New England Regional Transmission Organization service areas assuming a CO2 pricing scheme that is applied to the electricity sector but does not directly regulate emissions from other sectors. We find that a shift from coal toward natural gas and wind generation is sufficient to achieve a 50% reduction in electricity-sector CO2 emissions while supporting vehicle charging for 25% of the vehicle fleet. The price impacts of these shifts are sensitive to demand side price responsiveness and the capital costs of new wind construction.::::::Unpublished::::::http://dx.doi.org/10.1016/j.seps.2012.09.004
Modeling the Impact of Electric Vehicle Charging on Heat Transfer around Underground Cables:::While increased use of plug-in electric vehicles (PEVs) has environmental and economic benefits, the increased load is expected to strain components of the power delivery infrastructure. Within electric distribution systems, overloading of transformers and underground cables and associated thermal degradation is of particular concern. The current paper estimates the effect of different levels and types of PEV charging on transient heating of underground cables. Transportation survey data is used to estimate travel miles and arrival/departure times for a typical residential neighborhood, which is subsequently used to estimate the electric load curve with different levels of PEV penetration. The estimated load curves are used to perform transient heat transfer computations for a system of three buried cables using an overset grid finite-difference approach, the results of which are used to estimate acceleration of cable thermal degradation. Vehicle charging, even for a modest 30% PEV penetration, is found to nearly double peak temperature rise above ambient at the cable surface, increase the daily variance in cable temperatures, and significantly decrease the estimated time to failure for cables with thermally sensitive insulation.::::::Published::::::http://www.sciencedirect.com/science/article/pii/S0378779612003586
Travel Demand and Charging Capacity for Electric Vehicles in Rural States: A Vermont Case Study:::As the number of electric vehicles (EVs) increase we must consider not only how this fuel switch may affect electrical power infrastructure but also mobility. Specifically, the suitability and charging requirements of these vehicles may differ in rural areas, where the electrical grid may be less robust and miles driven higher. Although other studies have examined issues of regional power requirements of EVs, none have done so in conjunction with the spatial considerations of travel demand. We use three datasets to forecast the future spatial distribution of EVs, as well as these vehicles’ ability to meet current daily travel demand: the National Household Travel Survey (NHTS), geocoded Vermont vehicle fleet data, and an E911 geocoded dataset of every building statewide. We consider spatial patterns in daily travel and home-based tours to identify optimal EV charging locations, as well as any area-types that are unsuited for widespread electric vehicle adoption. We found that hybrid vehicles were more likely to be near other hybrids than conventional vehicles were. This suggestion of clustering of current hybrid vehicles, in both urban and rural areas, suggests that the distribution of future EVs may also cluster in rural areas. Our analysis suggests that between 69 and 84% of the state’s vehicles could be replaced by a 40-mile range EV, depending on the availability of workplace charging. Problematic areas for EV adoption may be suburban areas, where both residential density is high (and potential clustering of hybrids), as well as miles driven. Our results suggest EVs are viable for rural mobility demand but require special consideration for power supply and vehicle charging infrastructure.::::::Published::::::http://www.uvm.edu/~phines/publications/2012/Aultman-Hall_2012.pdf
Estimating the Impact of Electric Vehicle Charging on Electricity Costs Given Electricity Sector Carbon Cap:::A model estimates the short-run effect of plug-in hybrid electric vehicle (PHEV) charging on electricity costs, given a cap on carbon dioxide (CO2) emissions that covers only the electricity sector. In the short run, cap-and-trade systems that cover the electricity sector increase the marginal cost of electricity production. The magnitude of the increase in cost depends on several factors, including the stringency of the cap in relation to the demand for electricity. The use of PHEVs, which also has the potential to decrease net greenhouse gas emissions, would increase demand for electricity and thus would increase the upward pressure on marginal costs. The model described examines this effect for the New England electricity market, which as of January 2009 operates under the Regional Greenhouse Gas Initiative, a cap-and-trade system for CO2. The model uses linear optimization to dispatch power plants to minimize fuel costs given inelastic electric demand and constraints on nitrogen oxide and CO2 emissions. The model is used to estimate costs for three fleet penetration levels (1%, 5%, and 10%) and three charging scenarios (evening charging, nighttime charging, and twice-a-day charging). The results indicate that PHEV charging demand increases the marginal cost of CO2 emissions as well as the average and marginal fuel costs for electricity generation. At all penetration levels the cost increases were minimized in the nighttime-charging scenario.::::::Published::::::http://trb.metapress.com/content/j28336176q41026h/
